No.,Chap,Sect,#,Question,Section Name,Short Text,Question Type,Chemical,LNG,LPG,Oil,Conditional,Hardware Response Type,Human Response Type,Process Response Type,ROVIQ List
2.1.1,2,1,1,"Were the Master and senior officers familiar with the company procedure for maintaining the vessel’s statutory certification up to date, were all certificates and documents carried onboard up to date and was the vessel free of conditions of class or significant memoranda?",Certification,Maintenance of Statutory Certification,Core,TRUE,TRUE,TRUE,TRUE,FALSE,Binary,Graduated,Graduated,"Documentation, Pre-board"
2.2.1,2,2,1,Had the vessel been attended by a company Superintendent at approximately six-monthly intervals and were reports available to demonstrate that a systematic vessel inspection had been completed during each attendance declared through the pre-inspection questionnaire?,Management Oversight,Superintendent vessel inspection and report,Core,TRUE,TRUE,TRUE,TRUE,FALSE,None,None,Binary,Documentation
2.2.2,2,2,2,"Were recent ISM internal audit reports available on board, had corrective action been taken on board to close-out any non-conformities and had this corrective action been verified by shore management?",Management Oversight,Internal ISM audit,Rotational 2,TRUE,TRUE,TRUE,TRUE,FALSE,None,Graduated,Graduated,Documentation
2.2.3,2,2,3,Was the Master fully conversant with the company’s Safety Management System and had Master’s Reviews of the system taken place in accordance with the ISM Code and company procedures?,Management Oversight,Master's Review of the SMS.,Rotational 2,TRUE,TRUE,TRUE,TRUE,FALSE,None,Graduated,Graduated,Documentation
2.3.1,2,3,1,"Were the Master and Chief Engineer familiar with the company procedure to maintain the Enhanced Survey File in accordance with Classification Society rules, and was the vessel free of any visible or documentary evidence of concerns with the structural condition of the hull or cargo and ballast tank coatings?",Structural Assessment,Structural concerns and Enhanced Survey File.,Core,TRUE,FALSE,FALSE,TRUE,FALSE,Graduated,Graduated,Graduated,"Documentation, Main Deck, Pre-board"
2.3.2,2,3,2,"Were the Master and Chief Engineer familiar with the company procedure to maintain the Class Survey File, and was the vessel free of any visible or documentary evidence of concerns with the structural condition of the hull or hold space and ballast tank coatings?",Structural Assessment,Structural concerns and Class Survey File.,Core,FALSE,TRUE,TRUE,FALSE,FALSE,Graduated,Graduated,Graduated,"Documentation, Main Deck, Pre-board"
2.3.3,2,3,3,"Were the Master and senior officers familiar with the company cargo, ballast & void space inspection and reporting procedure and, were records available to demonstrate that all inspections had been accomplished within the required time frame with reports completed in accordance with company instructions?",Structural Assessment,"Cargo, ballast & void space inspection",Rotational 2,TRUE,TRUE,TRUE,TRUE,FALSE,Binary,Graduated,Graduated,"Cargo Control Room, Documentation"
2.3.4,2,3,4,"Were the Master and deck officers familiar with the company procedures for detecting leakage of liquids between cargo, bunker, ballast, void and cofferdam spaces which included inspecting the surface of ballast water prior to discharge, and were records available to show that the necessary checks had been performed?",Structural Assessment,"Monitoring cargo, ballast & void spaces for leakage and contamination",Rotational 2,TRUE,TRUE,TRUE,TRUE,FALSE,Binary,Graduated,Graduated,"Cargo Control Room, Main Deck"
2.3.5,2,3,5,Had the vessel been enrolled in a Classification Society Condition Assessment Programme (CAP)?,Structural Assessment,Condition Assessment Program (CAP),Rotational 2,TRUE,TRUE,TRUE,TRUE,TRUE,None,None,Binary,"Documentation, Pre-board"
2.4.1,2,4,1,"Were the senior officers familiar with the company procedure for reporting defects to vessel structure, machinery and equipment to shore-based management through the company defect reporting system and was evidence available to demonstrate that all defects had been reported accordingly?",Defect Management,Defect reporting system,Core,TRUE,TRUE,TRUE,TRUE,FALSE,Binary,Graduated,Graduated,"Anywhere, Chief Engineer's Office, Documentation"
2.4.2,2,4,2,"Where defects existed to the vessel’s structure, machinery or equipment, had the vessel operator notified class, flag and/or the authorities in the port of arrival, as appropriate to the circumstances, and had short term certificates, waivers, exemptions and/or permissions to proceed the voyage been issued where necessary?",Defect Management,"Defect reporting to class, flag etc",Core,TRUE,TRUE,TRUE,TRUE,FALSE,Binary,Graduated,Graduated,Documentation
2.5.1,2,5,1,"Had the company Management of Change procedure been effectively implemented for changes affecting structure, machinery and equipment governed by Classification Society rules or statutory survey?",Management of Change,Management of Change,Rotational 1,TRUE,TRUE,TRUE,TRUE,FALSE,Binary,Graduated,Graduated,"Anywhere, Documentation"
2.6.1,2,6,1,"Were the Master, deck officers and engineer officers familiar with the vessel’s Ballast Water Management Plan and were records available to demonstrate that ballast handling had been conducted in accordance with the plan?",Statutory Management Plans,Ballast Water Management Plan,Rotational 2,TRUE,TRUE,TRUE,TRUE,FALSE,Binary,Graduated,Graduated,Cargo Control Room
2.6.2,2,6,2,"Were the Master and officers familiar with the VOC Management Plan, and had the procedures for minimising VOC emissions set out in the Plan been implemented and documented as required?",Statutory Management Plans,VOC Management Plan.,Rotational 1,FALSE,FALSE,FALSE,TRUE,TRUE,None,Graduated,Graduated,Cargo Control Room
2.6.3,2,6,3,Were the Master and senior officers familiar with the contents and requirements of the Ship Energy Efficiency Management Plan (SEEMP) and had these been fully implemented?,Statutory Management Plans,Ship Energy Efficiency Management Plan (SEEMP).,Rotational 1,TRUE,TRUE,TRUE,TRUE,FALSE,None,Graduated,Graduated,"Chief Engineer's Office, Documentation"
2.7.1,2,7,1,Was the relevant content of the SMS manuals easily accessible to all personnel on board in a working language(s) understood by them?,Safety Management System,Availability of SMS content to all crew.,Rotational 2,TRUE,TRUE,TRUE,TRUE,FALSE,None,Graduated,Graduated,"Bridge, Cargo Control Room, Documentation, Engine Control Room, Interview - Rating"
2.7.2,2,7,2,"Did the SMS identify clear levels of authority and lines of communication between the Master, ship's officers, ratings and the company, and were all onboard personnel familiar with these arrangements as they related to their position?",Safety Management System,Communication lines with the company and DPA.,Rotational 2,TRUE,TRUE,TRUE,TRUE,FALSE,None,Graduated,Graduated,"Bridge, Cargo Control Room, Engine Control Room, Interview - Rating, Interview Senior Officer"
2.8.1,2,8,1,"Was the OCIMF Harmonised Vessel Particulars Questionnaire (HVPQ) available through the OCIMF SIRE Programme database completed accurately to reflect the structure, outfitting, management and certification of the vessel?",General Information,HVPQ accurately completed.,Core,TRUE,TRUE,TRUE,TRUE,FALSE,None,None,Binary,"Documentation, Pre-board"
2.8.2,2,8,2,"Were records of the most recent Port State Control inspection available onboard, and where deficiencies had been recorded had these been corrected and closed out in accordance with the company procedure for defects or non-conformities?",General Information,Last Port State Control Inspection.,Rotational 1,TRUE,TRUE,TRUE,TRUE,FALSE,None,None,Graduated,"Documentation, Pre-board"
3.1.1,3,1,1,"Were the officers and ratings suitably qualified to serve onboard the vessel and did the officer matrix posted on the OCIMF website accurately reflect the qualifications, experience and English Language capabilities of the officers onboard at the time of the inspection?",Crew Qualification,Crew qualifications and matrix verification.,Rotational 1,TRUE,TRUE,TRUE,TRUE,FALSE,None,Graduated,Binary,Documentation
3.1.2,3,1,2,"Were procedures and instructions contained within the Safety Management System and signs posted around the vessel available in the designated working language of the vessel or a language(s) understood by the crew and, were the Master, officers and ratings able to communicate verbally in the designated working language?",Crew Qualification,Designated working language.,Rotational 1,TRUE,TRUE,TRUE,TRUE,FALSE,None,None,Graduated,Anywhere
3.1.3,3,1,3,"Did the complement of officers and ratings onboard at the time of inspection meet or exceed the requirements of the Minimum Safe Manning Document and the declared company standard manning for routine operations, and had senior officers been relieved to ensure continuity of operational knowledge?",Crew Qualification,"Minimum, standard and enhanced manning levels.",Rotational 2,TRUE,TRUE,TRUE,TRUE,FALSE,None,None,Binary,"Documentation, Pre-board"
3.2.1,3,2,1,Was a report available onboard which confirmed that a static navigational assessment by a suitably qualified and experienced company representative had been completed as declared through the pre-inspection questionnaire?,Crew Evaluation,Static navigational assessment,Rotational 1,TRUE,TRUE,TRUE,TRUE,TRUE,None,None,Binary,"Bridge, Documentation"
3.2.2,3,2,2,Was a report available onboard which confirmed that a dynamic navigational assessment by a suitably qualified and experienced company representative had been completed while on passage as declared through the pre-inspection questionnaire?,Crew Evaluation,Dynamic navigational assessment by a company representative,Rotational 1,TRUE,TRUE,TRUE,TRUE,TRUE,None,None,Binary,"Bridge, Documentation"
3.2.3,3,2,3,Was a report available onboard which confirmed that a dynamic navigational assessment by a suitably qualified specialist contractor had been completed while on passage as declared through the pre-inspection questionnaire?,Crew Evaluation,Dynamic navigational assessment by a specialist contractor,Rotational 1,TRUE,TRUE,TRUE,TRUE,TRUE,None,None,Binary,"Bridge, Documentation"
3.2.4,3,2,4,"Was a report available onboard which confirmed that an unannounced remote navigational assessment, which included review of VDR & ECDIS data by an independent contractor or specialist company representative, had been completed as declared through the pre-inspection questionnaire?",Crew Evaluation,Unannounced remote navigational assessment,Rotational 1,TRUE,TRUE,TRUE,TRUE,TRUE,None,None,Binary,"Bridge, Documentation"
3.2.5,3,2,5,Was a report available onboard which confirmed that a comprehensive cargo audit by a suitably qualified and experienced company representative had been completed as declared through the pre-inspection questionnaire?,Crew Evaluation,Comprehensive cargo audit by a company representative,Rotational 1,TRUE,TRUE,TRUE,TRUE,TRUE,None,None,Binary,"Cargo Control Room, Documentation"
3.2.6,3,2,6,Was a report available onboard which confirmed that a comprehensive engineering audit by a suitable qualified and experienced company representative had been completed as declared in the pre-inspection questionnaire?,Crew Evaluation,Comprehensive engineering audit by a company representative,Rotational 1,TRUE,TRUE,TRUE,TRUE,TRUE,None,None,Binary,"Chief Engineer's Office, Documentation, Engine Control Room"
3.2.7,3,2,7,Was a report available onboard which confirmed that a comprehensive mooring and anchoring audit by a suitably qualified and experienced company representative had been completed as declared through the pre-inspection questionnaire?,Crew Evaluation,Comprehensive mooring and anchoring audit by a company representative,Rotational 1,TRUE,TRUE,TRUE,TRUE,TRUE,None,None,Binary,Documentation
3.2.8,3,2,8,"Had the vessel operator implemented a Behavioural Competency Assessment Programme onboard and was there evidence available that assessments were being conducted for navigation, cargo, mooring and engineering operations by approved assessors?",Crew Evaluation,Behavioural Competency Assessment Programme,Rotational 2,TRUE,TRUE,TRUE,TRUE,TRUE,None,None,Binary,Documentation
3.3.1,3,3,1,Had the Master and all navigation officers attended a shore-based Bridge Team Management training course within the previous five years?,Crew Training,Shore-based Bridge Team Management training,Rotational 2,TRUE,TRUE,TRUE,TRUE,TRUE,None,None,Binary,Documentation
3.3.2,3,3,2,Had the Master received formal ship handling training prior to promotion or when being assigned to a new type of ship having significantly different handling characteristics to ships in which they had recently served?,Crew Training,Formal ship handling training,Rotational 2,TRUE,TRUE,TRUE,TRUE,FALSE,None,None,Binary,Documentation
3.3.3,3,3,3,"Had the Master, deck officers, and cargo/gas engineer where carried, attended a shore-based simulator course covering routine and emergency cargo operations within the previous five years?",Crew Training,Cargo operations shore-based simulator course,Rotational 2,TRUE,TRUE,TRUE,TRUE,TRUE,None,None,Binary,Documentation
3.3.4,3,3,4,Had the Chief Engineer and all engineer officers attended a shore-based engine room management simulator course covering routine and emergency machinery operations within the previous five years?,Crew Training,Shore-based engine room management simulator course,Rotational 2,TRUE,TRUE,TRUE,TRUE,TRUE,None,None,Binary,Documentation
3.3.5,3,3,5,Did all key personnel onboard involved in Dynamically Positioned (DP) operations have appropriate training in accordance with IMO and International Marine Contractors Association (IMCA) guidelines and local regulations applicable to the area of operations?,Crew Training,Training for Dynamically Positioned (DP) operators,Rotational 2,FALSE,FALSE,FALSE,TRUE,TRUE,None,None,Graduated,"Bridge, Documentation"
3.3.6,3,3,6,"Had the Master, officers and ratings received the required training and familiarisation before being assigned duties related to handling LNG or other low-flashpoint fuel?",Crew Training,LNG or other low-flashpoint fuel training and familiarisation.,Rotational 2,TRUE,FALSE,TRUE,TRUE,TRUE,None,Graduated,Graduated,Documentation
3.4.1,3,4,1,"Was there an effective system in place to record and monitor the hours of rest for all personnel onboard in compliance with STCW, MLC or the regulatory requirements applicable to the vessel?",Crew Compliance,"Hours of rest, records and monitoring",Core,TRUE,TRUE,TRUE,TRUE,FALSE,None,Graduated,Graduated,Documentation
3.4.2,3,4,2,"Were the Master, officers and crew familiar with the company policy and procedures for drug and alcohol abuse prevention and had unannounced drug and alcohol testing taken place onboard in accordance with the policy?",Crew Compliance,Drug and alcohol abuse prevention,Rotational 2,TRUE,TRUE,TRUE,TRUE,FALSE,Binary,Graduated,Graduated,Documentation
3.5.1,3,5,1,"Had the company developed an effective familiarisation programme that covered the personal safety and professional responsibilities of all onboard personnel, including visitors and contractors, and were records available to demonstrate that the familiarisation had been completed as required?",Crew Familiarisation,"Familiarisation of crew, visitors and contractors",Core,TRUE,TRUE,TRUE,TRUE,FALSE,None,Graduated,Graduated,"Anywhere, Documentation"
3.5.2,3,5,2,"Were the Master, officers and ratings familiar with the ship’s lifesaving and fire extinguishing appliances and, had ongoing onboard training and instruction taken place to maintain familiarity?",Crew Familiarisation,Training and instruction LSA and FFA,Rotational 1,TRUE,TRUE,TRUE,TRUE,FALSE,Binary,Graduated,Graduated,"Anywhere, Documentation"
3.5.3,3,5,3,Had the Master and navigation officers been familiarised with the ECDIS equipment installed on board and were documented records of this familiarisation available?,Crew Familiarisation,Familiarisation with ECDIS equipment installed on board.,Rotational 2,TRUE,TRUE,TRUE,TRUE,FALSE,None,Graduated,Graduated,"Bridge, Documentation"
4.1.1,4,1,1,Were the Master and navigation officers familiar with the company procedures for the set up and operation of the ECDIS units fitted to the vessel and were records available to demonstrate that the ECDIS had been operated in accordance with company procedures at all stages of a voyage?,Navigation Equipment,ECDIS set up and operation,Core,TRUE,TRUE,TRUE,TRUE,TRUE,Binary,Graduated,Graduated,Bridge
4.1.2,4,1,2,"Were the Master and navigation officers familiar with the company procedures for managing and operating the radar/ARPA units fitted to the vessel, and were records available to demonstrate that the units had been operated and tested in accordance with company procedures?",Navigation Equipment,Operation and testing of radar/ARPA,Core,TRUE,TRUE,TRUE,TRUE,FALSE,Binary,Graduated,Graduated,Bridge
4.1.3,4,1,3,Were the Master and navigation officers familiar with the company procedures for operating and testing the steering control systems fitted to the vessel and were records available to demonstrate that operation and testing had been carried out in accordance with the procedures?,Navigation Equipment,Operating and testing the steering control systems,Rotational 1,TRUE,TRUE,TRUE,TRUE,FALSE,Binary,Graduated,Graduated,Bridge
4.1.4,4,1,4,Were the Master and navigation officers familiar with the company procedures for using the Automatic Identification System (AIS) fitted to the vessel and were records available to confirm that periodic checks and tests had been carried out in accordance with the procedures?,Navigation Equipment,Automatic Identification System (AIS),Rotational 1,TRUE,TRUE,TRUE,TRUE,FALSE,Binary,Graduated,Graduated,Bridge
4.1.5,4,1,5,Were the Master and navigation officers familiar with the company procedure for the use of the Bridge Navigational Watch Alarm System (BNWAS) and were records available to demonstrate that it had been operated and tested in accordance with the procedure?,Navigation Equipment,Bridge Navigational Watch Alarm System (BNWAS),Rotational 1,TRUE,TRUE,TRUE,TRUE,FALSE,Binary,Graduated,Graduated,Bridge
4.1.6,4,1,6,"Were the Master and navigation officers familiar with the company procedures governing the management and operation of the Global Navigation Satellite System (GNSS) receivers fitted onboard and was the fitted equipment configured, used and checked in accordance with the procedure?",Navigation Equipment,Global Navigation Satellite System(s),Rotational 2,TRUE,TRUE,TRUE,TRUE,FALSE,Binary,Graduated,Graduated,Bridge
4.1.7,4,1,7,Were the Master and navigation officers familiar with the company procedures for operating and managing the echo sounder and were records maintained to demonstrate that the equipment fitted to the vessel had been tested and operated in accordance with the company expectations?,Navigation Equipment,Echo sounder,Rotational 2,TRUE,TRUE,TRUE,TRUE,FALSE,Binary,Graduated,Graduated,Bridge
4.1.8,4,1,8,Were the Master and navigation officers familiar with the company procedures for the operation and testing of the speed and distance measuring devices fitted to the vessel and were records available to demonstrate that periodic tests had been completed as required by the procedures?,Navigation Equipment,Speed and distance measuring devices,Rotational 2,TRUE,TRUE,TRUE,TRUE,FALSE,Binary,Graduated,Graduated,Bridge
4.1.9,4,1,9,"Were the Master and navigation officers familiar with the company procedures for the use and testing of the navigation lights and shapes, and was there evidence that the navigation lights had been tested to confirm full functionality and correct visibility?",Navigation Equipment,Navigation lights and shapes,Rotational 2,TRUE,TRUE,TRUE,TRUE,FALSE,Binary,Graduated,Graduated,Bridge
4.1.10,4,1,10,Were the Master and navigation officers familiar with the company procedure for managing Marine Safety Information broadcasts by NAVTEX and SafetyNET and were warnings affecting the vessel’s route plotted on the voyage charts?,Navigation Equipment,NAVTEX and SafetyNET,Rotational 2,TRUE,TRUE,TRUE,TRUE,FALSE,Binary,Graduated,Graduated,Bridge
4.1.11,4,1,11,Were the Master and navigation officers familiar with the company procedure for preserving data from the VDR/S-VDR and were records available to demonstrate that tests of the equipment had been completed as required?,Navigation Equipment,Preserving data from the VDR/S-VDR,Rotational 2,TRUE,TRUE,TRUE,TRUE,TRUE,Binary,Graduated,Graduated,Bridge
4.1.12,4,1,12,"Were the Master and navigation officers familiar with the company procedures relating to the magnetic and gyro compasses carried onboard, and were records available to demonstrate their accuracy and reliability?",Navigation Equipment,Magnetic and gyro compasses,Rotational 2,TRUE,TRUE,TRUE,TRUE,FALSE,Binary,Graduated,Graduated,Bridge
4.1.13,4,1,13,"Were the Master and navigation officers familiar with the company procedures for the operation and testing of the VHF/DSC transceivers fitted to the vessel, and were records available to demonstrate that periodic tests and checks had been completed in accordance with company expectations?",Navigation Equipment,VHF/DSC transceivers,Rotational 2,TRUE,TRUE,TRUE,TRUE,FALSE,Binary,Graduated,Graduated,Bridge
4.1.14,4,1,14,Were the Master and navigation officers familiar with the company procedure for testing and using the daylight signalling lamp?,Navigation Equipment,Daylight signalling lamp,Rotational 2,TRUE,TRUE,TRUE,TRUE,FALSE,Binary,Graduated,Graduated,Bridge
4.1.15,4,1,15,Were the Master and navigation officers familiar with the company procedures for the use and testing of the sound signalling equipment fitted to the vessel and were records available to confirm that periodic tests had been completed and the equipment used in accordance with company expectations?,Navigation Equipment,Sound signalling equipment,Rotational 2,TRUE,TRUE,TRUE,TRUE,FALSE,Binary,Graduated,Graduated,Bridge
4.2.1,4,2,1,"Were the Master and navigating officers familiar with the company passage planning procedures and had all voyages been appraised, planned, executed and monitored in accordance with company procedures, industry best practice and both local and international rules?",Navigational Procedures,Passage planning,Core,TRUE,TRUE,TRUE,TRUE,FALSE,None,Graduated,Graduated,Bridge
4.2.2,4,2,2,"Were the Master and navigation officers familiar with the company under keel clearance (UKC) policy and procedure, and were records available to demonstrate that the required calculations had been completed at the appropriate points during each voyage and the vessel had remained in compliance with the UKC policy?",Navigational Procedures,Under keel clearance (UKC) policy,Core,TRUE,TRUE,TRUE,TRUE,FALSE,None,Graduated,Graduated,Bridge
4.2.3,4,2,3,"Had the Master prepared Master's Standing Orders, supplemented by Daily Orders, which emphasised and reinforced the company expectations with regards to navigational requirements including restricted visibility, CPA/BCR and minimum passing distance from navigational dangers and navigational aids and, if so, had all navigation officers signed to acknowledge their understanding of the same?",Navigational Procedures,Master's Standing Orders and Daily Orders,Rotational 1,TRUE,TRUE,TRUE,TRUE,FALSE,None,Graduated,Graduated,Bridge
4.2.4,4,2,4,"Were the Master and navigation officers familiar with the company electronic chart management procedures and were onboard ENCs and RNCs managed, corrected and used appropriately?",Navigational Procedures,Electronic chart management.,Rotational 2,TRUE,TRUE,TRUE,TRUE,FALSE,Binary,Graduated,Graduated,Bridge
4.2.5,4,2,5,"Were the Master and navigation officers familiar with the company paper chart management procedures and were onboard paper charts managed, corrected and used appropriately?",Navigational Procedures,Paper chart management,Rotational 1,TRUE,TRUE,TRUE,TRUE,FALSE,Binary,Graduated,Graduated,Bridge
4.2.6,4,2,6,"Were the Master and navigation officers familiar with the company procedures for testing the navigational equipment, main propulsion, steering gear and thrusters prior to use and prior to critical phases of a passage or operation and, did checklists or logbook entries confirm the required tests had been completed as required?",Navigational Procedures,"Testing navigational equipment, main propulsion, steering gear and thrusters",Rotational 1,TRUE,TRUE,TRUE,TRUE,FALSE,Binary,Graduated,Graduated,Bridge
4.2.7,4,2,7,Were the Master and navigation officers familiar with the company procedure for the carriage and management of nautical publications and was evidence available to demonstrate that publications had been managed in accordance with the procedure?,Navigational Procedures,Nautical publications,Rotational 2,TRUE,TRUE,TRUE,TRUE,FALSE,Binary,Graduated,Graduated,Bridge
4.3.1,4,3,1,Were the master and navigation officers familiar with the company procedures defining the minimum bridge team composition and engine room operating mode and were records available to demonstrate that recent voyages had been planned and executed in accordance with company expectations?,Bridge and Machinery Space Team Management,Minimum bridge team composition,Core,TRUE,TRUE,TRUE,TRUE,FALSE,None,Graduated,Graduated,Bridge
4.3.2,4,3,2,"Were the engineer officers familiar with the company procedures defining machinery space operating mode and, where required to be attended, the machinery space team composition during the various stages of a voyage, and were records available to confirm the machinery space had been operated accordingly?",Bridge and Machinery Space Team Management,Machinery space team composition,Core,TRUE,TRUE,TRUE,TRUE,FALSE,None,Graduated,Graduated,"Bridge, Engine Control Room"
